Accession	Name	Source Database	Type	Integrated Into	Integrated Signatures	GO Terms
IPR000035	Alkylbase DNA glycosidase, conserved site  Molecular Function	interpro	conserved_site		PS00516	GO:0003905,GO:0006281
IPR000055	Type I restriction modification DNA specificity domain  Molecular Function	interpro	domain		PF01420	GO:0003677
IPR000093	DNA recombination protein RecR  Molecular Function	interpro	family		PTHR30446,MF_00017,TIGR00615	GO:0003677,GO:0046872,GO:0006281,GO:0006310
IPR000119	Histone-like DNA-binding protein  Molecular Function	interpro	family		PTHR33175,PF00216,SM00411,PR01727	GO:0003677,GO:0030527
IPR000123	RNA-directed DNA polymerase (reverse transcriptase), msDNA  Molecular Function	interpro	family		cd03487,PR00866	GO:0003723,GO:0003964,GO:0006278
IPR000201	Hepadnaviral P protein, N-terminal  Molecular Function	interpro	domain		PF00242	GO:0003677,GO:0003887,GO:0006260
IPR000212	DNA helicase, UvrD/REP type  Molecular Function	interpro	family		PTHR11070	GO:0003677,GO:0003678,GO:0005524
IPR000214	Zinc finger, DNA glycosylase/AP lyase-type  Molecular Function	interpro	domain		PS51066	GO:0003906,GO:0008270,GO:0016799,GO:0006284
IPR000232	Heat shock factor (HSF)-type, DNA-binding  Molecular Function	interpro	domain		PS00434,SM00415,PF00447,PR00056	GO:0003700,GO:0043565,GO:0006355
IPR000268	DNA-directed RNA polymerase subunit RPABC5/Rpb10  Molecular Function	interpro	family		PTHR23431,MF_00250,PIRSF005653,PF01194	GO:0003677,GO:0003899,GO:0006351
IPR000380	DNA topoisomerase, type IA  Molecular Function	interpro	family		PTHR42785,PTHR11390	GO:0003677,GO:0003917,GO:0006265
IPR000424	Primosome PriB/single-strand DNA-binding  Molecular Function	interpro	family		cd04496,PS50935,PF00436	GO:0003697
IPR000432	DNA mismatch repair protein MutS, C-terminal  Molecular Function	interpro	domain		PS00486,PF00488,SM00534	GO:0005524,GO:0030983,GO:0006298
IPR000565	DNA topoisomerase, type IIA, subunit B  Molecular Function	interpro	family		PR01159	GO:0003677,GO:0003918,GO:0005524,GO:0006265
IPR000605	Helicase, superfamily 3, single-stranded DNA/RNA virus  Molecular Function	interpro	domain		PF00910	GO:0003723,GO:0003724
IPR000635	Viral ssDNA-binding protein  Molecular Function	interpro	family		MF_04007,PF00747	GO:0003697,GO:0006260,GO:0042025
IPR000977	DNA ligase, ATP-dependent  Molecular Function	interpro	family		TIGR00574	GO:0003910,GO:0005524,GO:0071897
IPR001001	DNA polymerase III, beta sliding clamp  Molecular Function	interpro	family		PIRSF000804,cd00140,PTHR30478,TIGR00663,SM00480	GO:0003677,GO:0006260,GO:0009360
IPR001083	Copper fist DNA-binding domain  Molecular Function	interpro	domain		SM01090,SM00412,PR00617,PF00649,PS50073,PS01119	GO:0003677,GO:0003700,GO:0005507,GO:0006355
IPR001091	Restriction/modification DNA-methyltransferase  Molecular Function	interpro	family		PR00508	GO:0003677,GO:0008170
IPR001098	DNA-directed DNA polymerase, family A, palm domain  Molecular Function	interpro	domain		SM00482,PF00476	GO:0003677,GO:0003887,GO:0006260
IPR001130	3'-5' ssDNA/RNA exonuclease TatD-like  Molecular Function	interpro	family		cd01310,PF01026,PIRSF005902	GO:0016788
IPR001138	Zn(2)Cys(6) fungal-type DNA-binding domain  Molecular Function	interpro	domain		cd00067,PS50048,PS00463,SM00066,PF00172	GO:0000981,GO:0008270,GO:0006355
IPR001154	DNA topoisomerase II, eukaryotic-type  Molecular Function	interpro	family		PR01158	GO:0003677,GO:0003918,GO:0005524,GO:0006265
IPR001177	DNA helicase E1, C-terminal, Papillomavirus  Molecular Function	interpro	domain		PF00519	GO:0003677,GO:0003678,GO:0005524,GO:0006260
IPR001238	DNA-binding, RecF  Molecular Function	interpro	family		MF_00365,TIGR00611	GO:0003697,GO:0005524,GO:0006281
IPR001241	DNA topoisomerase, type IIA  Molecular Function	interpro	family		SM00433	GO:0003677,GO:0003918,GO:0005524,GO:0006265
IPR001275	DM DNA-binding domain  Molecular Function	interpro	domain		PS50809,PF00751,PS40000,SM00301	GO:0043565,GO:0006355
IPR001305	Heat shock protein DnaJ, cysteine-rich domain  Molecular Function	interpro	domain		PS51188,cd10719,PF00684	GO:0031072,GO:0051082
IPR001346	Interferon regulatory factor, DNA-binding domain  Molecular Function	interpro	domain		cd00103,PF00605,SM00348,PS51507,PR00267	GO:0000976
IPR001462	Hepadnaviral P protein, C-terminal  Molecular Function	interpro	domain		PF00336	GO:0004523
IPR001497	Methylated-DNA-[protein]-cysteine S-methyltransferase, active site  Molecular Function	interpro	active_site		PS00374	GO:0003908,GO:0006281
IPR001514	DNA-directed RNA polymerase, 30-40kDa subunit, conserved site  Molecular Function	interpro	conserved_site		PS00446	GO:0003677,GO:0003899,GO:0006351
IPR001604	DNA/RNA non-specific endonuclease/pyrophosphatase/phosphodiesterase domain  Molecular Function	interpro	domain		SM00892,PF01223	GO:0003676,GO:0016787,GO:0046872
IPR001606	ARID DNA-binding domain  Molecular Function	interpro	domain		PS51011,PF01388,SM00501	GO:0003677
IPR001631	DNA topoisomerase I  Molecular Function	interpro	family		PR00416	GO:0003677,GO:0003917,GO:0006265
IPR001647	DNA-binding HTH domain, TetR-type  Molecular Function	interpro	domain		PS50977,PR00455,PF00440	GO:0003677
IPR001679	NAD-dependent DNA ligase  Molecular Function	interpro	family		MF_01588,TIGR00575,PIRSF001604	GO:0003911,GO:0006260,GO:0006281
IPR001726	DNA nucleotidylexotransferase (TdT) / DNA-directed DNA/RNA polymerase mu  Molecular Function	interpro	family		PIRSF000817,PR00871	GO:0034061
IPR001739	Methyl-CpG DNA binding  Molecular Function	interpro	domain		PS50982,PF01429,SM00391	GO:0003677
IPR001801	DNA-binding protein H-NS-like  Molecular Function	interpro	family		PIRSF002096	GO:0003677,GO:0030527,GO:0006355
IPR001845	HTH ArsR-type DNA-binding domain  Molecular Function	interpro	domain		PS50987,PF01022,SM00418,PR00778	GO:0003700,GO:0006355
IPR001867	OmpR/PhoB-type DNA-binding domain  Molecular Function	interpro	domain		cd00383,SM00862,PS51755,PF00486	GO:0003677,GO:0000160,GO:0006355
IPR001957	Chromosomal replication control, initiator DnaA  Molecular Function	interpro	family		MF_00377,TIGR00362	GO:0003677,GO:0003688,GO:0005524,GO:0006270,GO:0006275
IPR002008	DNA polymerase family X, beta-like  Molecular Function	interpro	family		PR00870	GO:0003677,GO:0006281
IPR002043	Uracil-DNA glycosylase family 1  Molecular Function	interpro	family		cd10027,MF_00148,TIGR00628,PTHR11264	GO:0004844,GO:0006281,GO:0006284
IPR002052	DNA methylase, N-6 adenine-specific, conserved site  Molecular Function	interpro	conserved_site		PS00092	GO:0003676,GO:0008168,GO:0032259
IPR002054	DNA-directed DNA polymerase X  Molecular Function	interpro	domain		cd00141,SM00483	GO:0003677,GO:0003887
IPR002059	Cold-shock protein Csp, DNA-binding  Molecular Function	interpro	domain		cd04458,PS51857,PR00050,PF00313	GO:0003676
IPR002092	DNA-directed RNA polymerase, phage-type  Molecular Function	interpro	family		PS00489,PS00900,PTHR10102	GO:0003677,GO:0003899,GO:0006351
IPR002099	DNA mismatch repair protein MutL/Mlh/PMS  Molecular Function	interpro	family		TIGR00585	GO:0005524,GO:0030983,GO:0006298
IPR002176	Crossover junction endodeoxyribonuclease RuvC  Molecular Function	interpro	family		cd16962,PTHR30194,MF_00034,TIGR00228,PR00696,PF02075	GO:0004520,GO:0006281,GO:0006310
IPR002197	DNA binding HTH domain, Fis-type  Molecular Function	interpro	domain		PF02954,PR01590	GO:0043565
IPR002205	DNA topoisomerase, type IIA, domain A  Molecular Function	interpro	domain		cd00187,PF00521,SM00434	GO:0003677,GO:0003918,GO:0005524,GO:0006265
IPR002288	DNA gyrase B subunit, C-terminal  Molecular Function	interpro	domain		PF00986	GO:0003677,GO:0003918,GO:0005524,GO:0006265
IPR002297	DNA-directed DNA-polymerase, family A, mitochondria  Molecular Function	interpro	family		PTHR10267,PIRSF000797,PR00867	GO:0003677,GO:0006260,GO:0005760
IPR002298	DNA polymerase A  Molecular Function	interpro	family		PTHR10133,PR00868	GO:0003887,GO:0006261
IPR002706	DNA-repair protein Xrcc1, N-terminal  Molecular Function	interpro	domain		PF01834	GO:0003684,GO:0000012,GO:0005634
IPR002755	DNA primase, small subunit  Molecular Function	interpro	family		PF01896	GO:0003896,GO:0006269
IPR002775	DNA/RNA-binding protein Alba-like  Molecular Function	interpro	domain		PF01918	GO:0003676
IPR002815	Spo11/DNA topoisomerase VI subunit A  Molecular Function	interpro	family		PR01550,PTHR10848	GO:0003677,GO:0003918,GO:0005694
IPR002941	DNA methylase N-4/N-6  Molecular Function	interpro	domain		PF01555	GO:0003677,GO:0008170
IPR003133	T antigen, Ori-binding  Molecular Function	interpro	domain		PS51287,PF02217	GO:0003688,GO:0006260
IPR003150	DNA-binding RFX-type winged-helix domain  Molecular Function	interpro	domain		PS51526,PF02257	GO:0003677,GO:0006355
IPR003176	Adenovirus DNA-binding, all-alpha domain  Molecular Function	interpro	domain		PF02236	GO:0003677,GO:0006268
IPR003180	Methylpurine-DNA glycosylase  Molecular Function	interpro	family		cd00540,MF_00527,PF02245,TIGR00567,PTHR10429	GO:0003677,GO:0003905,GO:0006284
IPR003202	DNA polymerase processivity factor (UL42)  Molecular Function	interpro	family		PF02282	GO:0003677,GO:0006260
IPR003212	DNA-binding protein 7a-e  Molecular Function	interpro	family		NF045555,PIRSF036912,PF02294	GO:0003677,GO:0004521
IPR003310	G/T mismatch-specific thymine DNA glycosylasee TDG-like, eukaryotes  Molecular Function	interpro	family		TIGR00584	GO:0000700,GO:0006285
IPR003340	B3 DNA binding domain  Molecular Function	interpro	domain		cd10017,SM01019,PS50863,PF02362	GO:0003677
IPR003356	DNA methylase, adenine-specific  Molecular Function	interpro	domain		PF02384	GO:0003677,GO:0008170
IPR003512	Bacteriophage M13, G5P, DNA-binding  Molecular Function	interpro	family		PF02303	GO:0003697,GO:0006260
IPR003583	Helix-hairpin-helix DNA-binding motif, class 1  Molecular Function	interpro	domain		SM00278	GO:0003677,GO:0006281
IPR003601	DNA topoisomerase, type IA, domain 2  Molecular Function	interpro	domain		SM00436	GO:0003677,GO:0003916,GO:0006265
IPR003602	DNA topoisomerase, type IA, DNA-binding domain  Molecular Function	interpro	domain		SM00437	GO:0003677,GO:0003916,GO:0006265
IPR003701	DNA double-strand break repair protein Mre11  Molecular Function	interpro	family		PIRSF000882,TIGR00583	GO:0004520,GO:0008296,GO:0006302,GO:0030870
IPR003716	DNA-directed RNA polymerase, omega subunit  Molecular Function	interpro	family		PTHR34476,MF_00366,TIGR00690	GO:0003899,GO:0006351
IPR003840	DNA replication helicase domain  Molecular Function	interpro	domain		PF02689	GO:0004386,GO:0005524
IPR004026	Ada DNA repair, metal-binding  Molecular Function	interpro	domain		PF02805	GO:0003677,GO:0008168,GO:0008270,GO:0006281,GO:0006355
IPR004085	DNA topoisomerase VI, subunit A  Molecular Function	interpro	family		MF_00132,PR01552	GO:0003677,GO:0003918,GO:0006265,GO:0005694
IPR004149	Zinc-finger, NAD-dependent DNA ligase C4-type  Molecular Function	interpro	domain		PF03119	GO:0003911,GO:0006260,GO:0006281
IPR004150	NAD-dependent DNA ligase, OB-fold  Molecular Function	interpro	domain		PF03120	GO:0003911,GO:0006260,GO:0006281
IPR004186	Epstein Barr virus nuclear antigen-1, DNA-binding  Molecular Function	interpro	domain		PF02905	GO:0003677,GO:0006275,GO:0045893,GO:0042025
IPR004191	Integrase, Tn916-type, N-terminal DNA binding  Molecular Function	interpro	domain		PF02920	GO:0003677,GO:0008907,GO:0015074
IPR004230	DNA mismatch repair protein MutH  Molecular Function	interpro	family		MF_00759,TIGR02248	GO:0003677,GO:0004519,GO:0006304
IPR004475	DNA polymerase II large subunit DP2  Molecular Function	interpro	family		PTHR42210,MF_00324,PIRSF016275,TIGR00354	GO:0003677,GO:0003887,GO:0006260
IPR004504	DNA repair protein RadA  Molecular Function	interpro	family		MF_01498,TIGR00416	GO:0003684,GO:0005524,GO:0006281
IPR004519	DNA-directed RNA polymerase, subunit E/RPC8  Molecular Function	interpro	family		TIGR00448	GO:0003677,GO:0003899,GO:0006351
IPR004577	8-oxoguanine DNA-glycosylase  Molecular Function	interpro	family		TIGR00588	GO:0008534,GO:0034039,GO:0006284
IPR004580	DNA repair protein Rad18, fungi  Molecular Function	interpro	family		TIGR00599	GO:0003697,GO:0061630,GO:0006301,GO:0006513
IPR004583	DNA repair protein Rad4  Molecular Function	interpro	family		PTHR12135	GO:0003684,GO:0006289,GO:0005634
IPR004584	DNA repair protein Rad50, eukaryotes  Molecular Function	interpro	family		TIGR00606	GO:0016887,GO:0000723,GO:0006281,GO:0005634,GO:0030870
IPR004589	DNA helicase, ATP-dependent, RecQ type  Molecular Function	interpro	family		TIGR00614	GO:0004386,GO:0006310
IPR004590	DNA single-strand annealing protein RecT  Molecular Function	interpro	family		TIGR00616	GO:0003677,GO:0006259
IPR004597	DNA-3-methyladenine glycosylase I  Molecular Function	interpro	family		TIGR00624	GO:0008725,GO:0006284
IPR004603	DNA mismatch endonuclease VSR  Molecular Function	interpro	family		cd00221,PIRSF018267,TIGR00632,PF03852	GO:0004519,GO:0006298
IPR004604	DNA recombination/repair protein RecN  Molecular Function	interpro	family		PIRSF003128,TIGR00634,PTHR11059	GO:0005524,GO:0006281,GO:0006310
IPR004605	Holliday junction branch migration complex subunit RuvB  Molecular Function	interpro	family		PTHR42848,MF_00016,TIGR00635	GO:0003677,GO:0005524,GO:0009378,GO:0006281,GO:0006310
IPR004609	ATP-dependent DNA helicase RecG  Molecular Function	interpro	family		TIGR00643	GO:0003678,GO:0006281,GO:0006310
IPR004615	DNA polymerase III, psi subunit  Molecular Function	interpro	family		PIRSF029225,PF03603	GO:0003887,GO:0008408,GO:0006260
IPR004622	DNA polymerase III, delta prime subunit  Molecular Function	interpro	domain		TIGR00678	GO:0003887,GO:0008408,GO:0006260
IPR004645	DNA-binding protein Tfx, archaea  Molecular Function	interpro	family		TIGR00721	GO:0003677
IPR004805	Error-prone DNA polymerase/DNA polymerase III subunit alpha DnaE/PolC  Molecular Function	interpro	family		PTHR32294,TIGR00594	GO:0008408,GO:0006260
IPR004868	DNA-directed DNA polymerase, family B, mitochondria/virus  Molecular Function	interpro	domain		PF03175	GO:0000166,GO:0003677,GO:0003887,GO:0006260
IPR004947	Deoxyribonuclease II  Molecular Function	interpro	family		PTHR10858,PF03265	GO:0004531,GO:0006259
IPR004973	DNA-directed RNA polymerase, 18kDa subunit, poxviral  Molecular Function	interpro	family		PF03293	GO:0003677,GO:0003899,GO:0019083
IPR005059	DNA-directed RNA polymerase, 35kDa subunit, poxviral  Molecular Function	interpro	family		PF03396,PIRSF000746	GO:0003677,GO:0003899,GO:0019083
IPR005104	Winged helix-turn-helix transcription repressor, HrcA DNA-binding domain  Molecular Function	interpro	domain		PF03444	GO:0003677,GO:0006355
IPR005319	Peptidase S48, DNA-binding transcriptional activator HetR  Molecular Function	interpro	family		MF_00781,PF03574	GO:0003677,GO:0004252,GO:0043158
IPR005376	Adenovirus DNA-binding, zinc-binding domain  Molecular Function	interpro	domain		PF03728	GO:0003677,GO:0008270,GO:0006260
IPR005412	DNA-binding protein Fis  Molecular Function	interpro	family		MF_00166,PIRSF002097,PR01591	GO:0003677,GO:0006355
IPR005559	CG-1 DNA-binding domain  Molecular Function	interpro	domain		SM01076,PS51437,PF03859	GO:0003677
IPR005569	Arc-like DNA binding domain  Molecular Function	interpro	domain		PF03869	GO:0003677
IPR005570	DNA-directed RNA polymerases I, II, and III subunit RPABC3  Molecular Function	interpro	family		PF03870,SM00658,PIRSF000779,PTHR10917	GO:0003899,GO:0006351
IPR005584	DNA gyrase inhibitor YacG  Molecular Function	interpro	family		PTHR36150,MF_00649,PF03884	GO:0008270
IPR005733	DNA topoisomerase I, bacterial-type  Molecular Function	interpro	family		TIGR01051	GO:0003677,GO:0003917,GO:0006265
IPR005734	DNA topoisomerase VI, subunit B  Molecular Function	interpro	family		MF_00322,TIGR01052,PIRSF006553	GO:0003677,GO:0003918,GO:0005524,GO:0006265
IPR005737	DNA topoisomerase IV, subunit B, Gram-negative  Molecular Function	interpro	family		MF_00938,TIGR01055,PR01098	GO:0003677,GO:0003918,GO:0005524,GO:0006265,GO:0005694
IPR005738	DNA topoisomerase III  Molecular Function	interpro	family		MF_00953,TIGR01056	GO:0003677,GO:0003916,GO:0006265
IPR005739	DNA topoisomerase I, archeal-type  Molecular Function	interpro	family		TIGR01057	GO:0003677,GO:0003916,GO:0006265
IPR005740	DNA topoisomerase 4 subunit B, Firmicutes/Mollicutes  Molecular Function	interpro	family		MF_00939,TIGR01058	GO:0003677,GO:0003918,GO:0005524,GO:0006265,GO:0005694
IPR005741	DNA topoisomerase IV subunit A, Gram-positive  Molecular Function	interpro	family		MF_00937,TIGR01061	GO:0003677,GO:0003918,GO:0005524,GO:0006265,GO:0005694
IPR005742	DNA topoisomerase IV, subunit A, Gram-negative  Molecular Function	interpro	family		MF_00936	GO:0003677,GO:0003918,GO:0005524,GO:0006265,GO:0005694
IPR005743	DNA gyrase, subunit A  Molecular Function	interpro	family		MF_01897	GO:0003677,GO:0003918,GO:0005524,GO:0006265,GO:0005694
IPR005748	DNA mismatch repair protein MutS  Molecular Function	interpro	family		MF_00096,TIGR01070	GO:0005524,GO:0030983,GO:0006298
IPR005751	ATP-dependent DNA helicase PcrA  Molecular Function	interpro	family		TIGR01073	GO:0003678,GO:0006268,GO:0005737
IPR005752	ATP-dependent DNA helicase Rep  Molecular Function	interpro	family		MF_01920,TIGR01074	GO:0003677,GO:0003678,GO:0005524,GO:0006268
IPR005753	DNA helicase, ATP-dependent, UvrD type  Molecular Function	interpro	family		TIGR01075	GO:0003678,GO:0006268,GO:0005737
IPR005790	DNA polymerase III, delta subunit  Molecular Function	interpro	family		TIGR01128	GO:0003677,GO:0006260
IPR006054	DNA polymerase III epsilon subunit, exonuclease domain  Molecular Function	interpro	domain		TIGR00573	GO:0003677,GO:0003887,GO:0006260
IPR006085	XPG, N-terminal  Molecular Function	interpro	domain		SM00485,PF00752	GO:0004518
IPR006134	DNA-directed DNA polymerase, family B, multifunctional domain  Molecular Function	interpro	domain		PF00136	GO:0000166,GO:0003677
IPR006167	DNA repair protein XPF  Molecular Function	interpro	family		TIGR00596	GO:0003697,GO:0004520,GO:0006281
IPR006172	DNA-directed DNA polymerase, family B  Molecular Function	interpro	family		SM00486,PR00106	GO:0000166,GO:0003676,GO:0003887
IPR006199	LexA repressor, DNA-binding domain  Molecular Function	interpro	domain		PF01726	GO:0004252,GO:0006508
IPR006293	DNA helicase, ATP-dependent, RecQ type, bacterial  Molecular Function	interpro	family		TIGR01389	GO:0003678,GO:0006310,GO:0009432
IPR006295	DNA primase, DnaG  Molecular Function	interpro	domain		TIGR01391	GO:0003896,GO:0006269
IPR006308	DNA polymerase III, alpha subunit, PolC-type, Gram-positive bacteria  Molecular Function	interpro	family		MF_00356,TIGR01405	GO:0003677,GO:0003887,GO:0006260,GO:0005737
IPR006309	DNA polymerase 3, epsilon subunit  Molecular Function	interpro	family		cd06131,TIGR01406	GO:0003677,GO:0003887,GO:0006260
IPR006345	ATP-dependent RecD2 DNA helicase  Molecular Function	interpro	family		TIGR01448,MF_01488	GO:0003677,GO:0043139,GO:0032508
IPR006691	DNA gyrase/topoisomerase IV, subunit A, C-terminal repeat  Molecular Function	interpro	repeat		PF03989	GO:0003677,GO:0003916,GO:0005524,GO:0006265
IPR006754	Poxvirus I3 ssDNA-binding  Molecular Function	interpro	family		PF04661,PIRSF003767	GO:0003697
IPR006779	DNA binding protein S1FA  Molecular Function	interpro	family		PTHR35298,PF04689	GO:0003677,GO:0006355,GO:0005634
IPR006824	DNA helicase, Baculovirus  Molecular Function	interpro	family		PF04735	GO:0003678,GO:0019079
IPR007015	DNA polymerase V/Myb-binding protein 1A  Molecular Function	interpro	family		PF04931,PTHR13213	GO:0003677,GO:0008134,GO:0006355,GO:0005730
IPR007120	DNA-directed RNA polymerase, subunit 2, hybrid-binding domain  Molecular Function	interpro	domain		PF00562	GO:0003677,GO:0003899,GO:0006351
IPR007185	DNA polymerase alpha/delta/epsilon, subunit B  Molecular Function	interpro	domain		PF04042	GO:0003677,GO:0006260
IPR007281	Mre11, DNA-binding  Molecular Function	interpro	domain		SM01347,PF04152	GO:0004519,GO:0030145,GO:0006302,GO:0005634
IPR007459	DNA polymerase III chi subunit, HolC  Molecular Function	interpro	family		PTHR38767,PF04364	GO:0003677,GO:0003887,GO:0006260
IPR007492	LytTR DNA-binding domain  Molecular Function	interpro	domain		PS50930,SM00850,PF04397	GO:0003677
IPR007634	RNA polymerase sigma factor 54, DNA-binding  Molecular Function	interpro	domain		PF04552	GO:0001216
IPR007692	DNA helicase, DnaB type  Molecular Function	interpro	family		TIGR00665	GO:0003677,GO:0003678,GO:0005524,GO:0006260
IPR007693	DNA helicase, DnaB-like, N-terminal  Molecular Function	interpro	domain		PF00772	GO:0003678,GO:0005524,GO:0006260
IPR007694	DNA helicase, DnaB-like, C-terminal  Molecular Function	interpro	domain		cd00984,PS51199,PF03796	GO:0003678,GO:0005524,GO:0006260
IPR007695	DNA mismatch repair protein MutS-like, N-terminal  Molecular Function	interpro	domain		PF01624	GO:0005524,GO:0030983,GO:0006298
IPR007696	DNA mismatch repair protein MutS, core  Molecular Function	interpro	domain		PF05192,SM00533	GO:0005524,GO:0030983,GO:0006298
IPR007811	DNA-directed RNA polymerase III subunit RPC4  Molecular Function	interpro	family		PTHR13408,PF05132	GO:0003677,GO:0006383,GO:0005666
IPR007860	DNA mismatch repair protein MutS, connector domain  Molecular Function	interpro	domain		PF05188	GO:0005524,GO:0030983,GO:0006298
IPR007861	DNA mismatch repair protein MutS, clamp  Molecular Function	interpro	domain		PF05190	GO:0005524,GO:0030983,GO:0006298
IPR007889	DNA binding HTH domain, Psq-type  Molecular Function	interpro	domain		PS50960,PF04218,PF05225	GO:0003677
IPR007984	DNA-directed RNA polymerase, 19kDa subunit, poxviral  Molecular Function	interpro	family		PF05320,PIRSF000743	GO:0003677,GO:0003899,GO:0006351
IPR008029	Bacteriophage T7, Gp3, endodeoxynuclease I  Molecular Function	interpro	family		cd22324,PF05367	GO:0008833,GO:0015074,GO:0016032
IPR008045	DNA replication licensing factor Mcm2  Molecular Function	interpro	family		PF12619,PR01658	GO:0003677,GO:0005524,GO:0006270,GO:1905775,GO:0005634,GO:0042555
IPR008046	DNA replication licensing factor Mcm3  Molecular Function	interpro	family		PR01659	GO:0003677,GO:0005524,GO:0006270,GO:0042555
IPR008048	DNA replication licensing factor Mcm5  Molecular Function	interpro	family		PR01661	GO:0003688,GO:0005524,GO:0006270,GO:0005634,GO:0042555
IPR008049	DNA replication licensing factor Mcm6  Molecular Function	interpro	family		PR01662	GO:0003677,GO:0003678,GO:0005524,GO:0006270,GO:0005634,GO:0042555
IPR008050	DNA replication licensing factor Mcm7  Molecular Function	interpro	family		cd17758,PR01663	GO:0003677,GO:0003678,GO:0005524,GO:0006270,GO:0042555
IPR008116	Sequence-specific single-strand DNA-binding protein  Molecular Function	interpro	family		PR01743	GO:0003697
IPR008148	DNA photolyase class 2  Molecular Function	interpro	family		TIGR00591	GO:0003904,GO:0006281
IPR008193	DNA-directed RNA polymerase Rpb11, 13-16kDa subunit, conserved site  Molecular Function	interpro	conserved_site		PS01154	GO:0003677,GO:0003899,GO:0006351
IPR008332	Methylguanine DNA methyltransferase, ribonuclease-like domain  Molecular Function	interpro	domain		PF02870	GO:0003908,GO:0006281
IPR008336	DNA topoisomerase I, DNA binding, eukaryotic-type  Molecular Function	interpro	domain		PF02919	GO:0003677,GO:0003917,GO:0006265
IPR008448	DNA-directed RNA polymerase, 7kDa polypeptide, chordopoxviral  Molecular Function	interpro	family		PF05864	GO:0003677,GO:0003899,GO:0006351
IPR008593	DNA N-6-adenine-methyltransferase  Molecular Function	interpro	family		PF05869,TIGR01712	GO:0003677,GO:0009007,GO:0009307
IPR008865	DNA replication terminus site-binding protein  Molecular Function	interpro	family		MF_00483,PF05472,TIGR02648	GO:0003677,GO:0006274,GO:0005737
IPR008917	Transcription factor, Skn-1-like, DNA-binding domain superfamily  Molecular Function	interpro	homologous_superfamily		SSF47454	GO:0003677,GO:0006355
IPR008921	DNA polymerase III, clamp loader complex, gamma/delta/delta subunit, C-terminal  Molecular Function	interpro	homologous_superfamily		SSF48019	GO:0003677,GO:0006260
IPR008967	p53-like transcription factor, DNA-binding domain superfamily  Molecular Function	interpro	homologous_superfamily		SSF49417	GO:0003700,GO:0006355
IPR008971	HSP40/DnaJ peptide-binding  Molecular Function	interpro	homologous_superfamily		SSF49493	GO:0051082,GO:0006457
IPR009025	DNA-directed RNA polymerase, RBP11-like dimerisation domain  Molecular Function	interpro	domain		PF13656	GO:0046983,GO:0006351
IPR009044	ssDNA-binding transcriptional regulator  Molecular Function	interpro	homologous_superfamily		SSF54447,G3DSA:2.30.31.10	GO:0003677,GO:0006355
IPR009052	DNA polymerase III-theta, bacterial  Molecular Function	interpro	family		PF06440	GO:0003677,GO:0003887,GO:0006260
IPR009674	DNA-directed RNA polymerase I subunit RPA2, domain 4  Molecular Function	interpro	domain		PF06883	GO:0003899,GO:0006351,GO:0005634
IPR009767	DNA helicase, TraI type, C-terminal  Molecular Function	interpro	domain		PF07057	GO:0003677,GO:0003678,GO:0005524,GO:0016818
IPR009933	T-DNA border endonuclease VirD1  Molecular Function	interpro	family		PF07328	GO:0004519
IPR010093	SinI-like, DNA-binding domain  Molecular Function	interpro	domain		TIGR01764	GO:0003677
IPR010114	DNA-binding transcriptional regulator NtrC  Molecular Function	interpro	family		TIGR01818	GO:0000156,GO:0003677,GO:0005524,GO:0000160,GO:0006808
IPR010243	DNA-directed RNA polymerase beta subunit, bacterial-type  Molecular Function	interpro	family		MF_01321,TIGR02013	GO:0003677,GO:0003899,GO:0006351
IPR010285	DNA helicase Pif1-like, DEAD-box helicase domain  Molecular Function	interpro	domain		PF05970	GO:0003678,GO:0000723,GO:0006281
IPR010347	Tyrosyl-DNA phosphodiesterase I  Molecular Function	interpro	family		PF06087,PTHR12415	GO:0008081,GO:0006281,GO:0005634
IPR010372	DNA polymerase III delta, N-terminal  Molecular Function	interpro	domain		PF06144	GO:0003677,GO:0003887,GO:0006260,GO:0009360
IPR010584	Exodeoxyribonuclease 8  Molecular Function	interpro	family		PF06630	GO:0051908
IPR010585	DNA repair protein XRCC4  Molecular Function	interpro	family		PTHR28559	GO:0003677,GO:0006302,GO:0006310,GO:0005634
